{
  "schema_version": "1.0.0",
  "question_id": "far-q-000101",
  "created_at": "2026-08-13T20:00:00Z",
  "creation_provenance": {
    "purpose": "sample_candidate",
    "mechanism": "ai_assisted",
    "created_by": "Codex",
    "model_id": "openai-codex-gpt-5",
    "material_inputs": [
      {
        "input_id": "far-2026-01",
        "input_kind": "taxonomy",
        "version_or_date": "2026-01",
        "use": "Bind the exact FAR task and skill."
      },
      {
        "input_id": "far-rule-oci-components.v001",
        "input_kind": "rule",
        "version_or_date": "v001",
        "use": "Control the accounting treatment and answer."
      },
      {
        "input_id": "far-ref-fasb-codification-live.v001",
        "input_kind": "source",
        "version_or_date": "retrieved-2026-08-13",
        "use": "Provide authoritative U.S. GAAP provenance."
      },
      {
        "input_id": "far-p1-g2-sample.v001",
        "input_kind": "human_brief",
        "version_or_date": "v001",
        "use": "Bounded G2 sample design under the ratified goal."
      }
    ]
  }
}
